{
  "created_at": "2026-08-10T08:15:40.886522+00:00",
  "environment": {
    "cpu_count": 5,
    "implementation": "CPython",
    "machine": "x86_64",
    "platform": "Linux-6.18.35-x86_64-with-glibc2.41",
    "processor": "",
    "python": "3.13.5 (main, Jul 15 2026, 20:25:40) [GCC 14.2.0]"
  },
  "errors_path": null,
  "metrics_path": "metrics.json",
  "model": {
    "path": "artifacts/neural/byte_smoke.pt",
    "sha256": "76ca2c888f8823307ec3957c6749c7244ed7e2effe9dadf7d69422d96a7f1331"
  },
  "predictions_path": "predictions.jsonl",
  "run_id": "torch-byte-76ca2c888f88",
  "schema_version": "0.1",
  "status": "complete",
  "suite": {
    "path": "configs/suites/smoke.yaml",
    "sha256": "d581ffc406443469b2d2acef2d79eb7635fca56f603faea5902de37df8e85450"
  }
}
